{
  "schemaVersion": "1.0.0",
  "recordType": "run-journal-event",
  "caseName": "valid-case",
  "artifactPrefix": "sample",
  "eventId": "EVT-002",
  "sequence": 2,
  "timestamp": "2026-01-01T10:30:00Z",
  "phaseId": "0",
  "eventType": "ARTIFACTS-RECORDED",
  "actor": "AFF-0-coordinator",
  "summary": "Revised Phase 0 candidate recorded.",
  "artifactHashes": [
    {
      "path": "0-coordination/sample-coordination.md",
      "sha256": "fa53731bad1ec83b8bcc25b1a044cca9f885d7788f42c6e5cd6f2c254b83feb8"
    },
    {
      "path": "0-coordination/sample-coordination.html",
      "sha256": "29a0027a4a669a0718e8cea654a115572e485e0bff434d455fb43ff6af78031f"
    },
    {
      "path": "0-coordination/sample-input-inventory.json",
      "sha256": "aa7883b59a07e8cfd3368a8902af6281c9982622101f9f5d07f5fb6077436f8b"
    },
    {
      "path": "0-coordination/sample-model-plan.json",
      "sha256": "5eb77296d5f5caccff718242ed770184e81b655b0af956516510dab552220878"
    }
  ]
}
